{
  "asset_id": "pattern_python_import_001",
  "asset_type": "pattern",
  "knowledge_scope": "project",
  "knowledge_kind": "pattern",
  "title": "优先修复真实导入关系",
  "content": "遇到 Python 导入错误时，优先检查包结构和模块导入路径，不要先依赖 PYTHONPATH 兜底。",
  "scope": {
    "level": "task-family",
    "value": "python-import-error"
  },
  "source_episode_ids": [
    "ep_20260413_001"
  ],
  "source_candidate_ids": [
    "cand_20260413_001"
  ],
  "confidence": 0.84,
  "status": "active",
  "last_used_at": null,
  "created_at": "2026-04-13T10:20:00Z",
  "updated_at": "2026-04-13T10:20:00Z"
}
